Book Id,Title,Author,Author l-f,Additional Authors,ISBN,ISBN13,My Rating,Average Rating,Publisher,Binding,Number of Pages,Year Published,Original Publication Year,Date Read,Date Added,Bookshelves,Bookshelves with positions,Exclusive Shelf,My Review,Spoiler,Private Notes,Read Count,Owned Copies
219382634,The Twelve Kingdoms (Rose Wolfe and the Twelve Kingdoms),Dana A. Caldwell,"Caldwell, Dana A.",,"=""""","=""9798991489119""",4,4.44,Mystic Mongoose Books LLC,Paperback,560,2024,,2024/09/09,2024/09/08,indie-darlings,indie-darlings (#5),read,"A thrilling, jam-packed debut! <i>The Twelve Kingdoms</i> has a world and narrative structure identical to DnD, so if you love high fantasy and quest stories that move like a campaign, this book is a must read. It even has that slow burning feel at the beginning of the story where characters are thrown together and only fit into a puzzle the more they endure together as a team. There are also a LOT of twists and turns, some I could figure out easily and some I could not <i>imagine</i>, so prepare to be on edge throughout your read. I love Rose's internal journey; she faces triumphs and tribulations that don't always have a clean getaway, fitting right in with the rise of feminine characters making mistakes and having to endure their consequences. Her, Animo, and Ketch are the standouts--if they get hurt, I get hurt.<br/><br/>Caldwell does her due diligence to make sure you feel how large and expansive the world is through its set pieces and plethora of characters. I wish we had more time to explore each location further since they are so interesting, giving both the reader and characters some brevity between cut-throat action sequences. It was also difficult for me to connect with some secondary characters as more attention was given to those who would be pinnacle to the story's progression, but I admire how there's an entire glossary space given to share each character's name, pronunciation, and description. I await the sequel!",,,1,0
50659468,"A Court of Mist and Fury (A Court of Thorns and Roses, #2)",Sarah J. Maas,"Maas, Sarah J.",,"=""1635575583""","=""9781635575583""",5,4.64,Bloomsbury Publishing,Paperback,626,2020,2016,2024/10/04,2024/09/30,couldnot-put-down,couldnot-put-down (#39),read,"Maas is insane for this and I love it<br/><br/>The writing is incredibly strong in this entry. Tamlin's evolution is so natural and believable, I often found myself catching up with Feyre's exact thoughts as they're happening. Her despondence, depression, and revival is palpable. Rhysand steals every scene he's in as normal, and I enjoyed the introduction of new characters, Amren being my favorite.",,,1,0
57911600,Hell Followed With Us,Andrew Joseph White,"White, Andrew Joseph",,"=""1682633241""","=""9781682633243""",0,4.11,Peachtree Teen,Hardcover,416,2022,2022,,2024/09/28,to-read,to-read (#23),to-read,,,,0,0
52516230,Fairest,Marissa Meyer,"Meyer, Marissa",,"=""1250774055""","=""9781250774057""",5,3.95,Square Fish,Paperback,222,2020,2015,2024/09/24,2024/09/27,couldnot-put-down,couldnot-put-down (#38),read,"Let Levana say f*ck<br/><br/>I'm fortunate enough to read this <i>after</i> reading the main series. I've noticed that those who read in strict publishing order often did not have a good time with this book, and honestly, I'm sure I would have been the same back in 2015. The audiobook, as always, is incredible, and makes for an easier time to gawk, pace around the room, and be horrified. Simply put, you cannot be still when reading how disturbing Levana is as she shapes herself into the Evil Queen. Rebecca Soler is my favorite voice actor hands down.",,,1,0
203147386,"Apprentice to the Villain (Assistant to the Villain, #2)",Hannah Nicole Maehrer,"Maehrer, Hannah Nicole",,"=""1649377177""","=""9781649377173""",4,4.11,Entangled: Red Tower Books,Paperback,368,2024,2024,2024/09/20,2024/09/15,books-that-made-me-cry,books-that-made-me-cry (#9),read,"There are some books that I need to read so insistently that I run to B&N before my library can give it to me. This is one of those books.<br/><br/>I absolutely loved the mystery at play here and how revelations pile on top of each other as the story progresses (two are even on the last page). I enjoyed the expansion of the world and how seemingly small details in the first book become insanely important in this one. I read <i>Apprentice to the Villain</i> next to my fiancé and often found myself squealing, kicking my feet, and then repeating the scene to him because he has to know why I'm quaking. The humor is turned up three full notches and works incredibly well.<br/><br/>The only thing that stops me from calling this perfection is how quickly Trystan returns to Evie's side after the events of Book 1, but I won't dare try to tell you how I would have changed anything because the first seven chapters are so good, I wouldn't want that to go away...but maybe go wrong?<br/><br/>I have no idea what the third book is going to be called but I vote: <i>A Prodigy to the Villain</i>",,,1,0
213642097,Divide (One Light Trilogy #1),Hannah Gaudette,"Gaudette, Hannah",,"=""""","=""""",0,4.65,,Kindle Edition,347,2024,,,2024/09/26,to-read,to-read (#22),to-read,,,,0,0
202507554,"When the Moon Hatched (Moonfall, #1)",Sarah A. Parker,"Parker, Sarah A.",,"=""""","=""""",0,4.02,,Kindle Edition,718,2024,2024,,2024/09/25,to-read,to-read (#21),to-read,,,,0,0
123349658,"Rain of Shadows and Endings (Legacy, #1)",Melissa K. Roehrich,"Roehrich, Melissa K.",,"=""""","=""""",0,4.01,,Kindle Edition,670,2023,2023,,2024/09/25,to-read,to-read (#20),to-read,,,,0,0
123361932,"A Bright Heart (A Bright Heart, #1)",Kate Chenli,"Chenli, Kate",,"=""1454949929""","=""9781454949923""",5,3.77,Union Square & Co.,Hardcover,344,2023,2023,2024/09/01,2024/06/03,couldnot-put-down,couldnot-put-down (#37),read,"Did I read this book in two sittings? Yes, I did.<br/><br/>What a pallet cleanser after dragging myself through the ending of my last read. I was so excited about this book's concept, and it ",,,1,0
53287484,"Midnight Sun (The Twilight Saga, #5)",Stephenie Meyer,"Meyer, Stephenie",,"=""031670704X""","=""9780316707046""",3.5,3.74,"Little, Brown Books for Young Readers",Hardcover,662,2020,2020,2024/08/30,2024/08/20,,,read,"3.5 ⭐<br/><br/>Honestly what a power move on Stephanie Meyer's part to return 15 years later and give us Edward's POV during a rise of YA books including the male lead's perspective, particularly the experience of falling in love. And I think it's even more of a gamble to write the entirety of the first book through his experiences rather than something completely new like an origin story.<br/><br/>The gamble pays off...for the most part. Any time the book does invest time into Edward's vampiric origins, family dynamics, and powers, I am the most intrigued because that's something we can't get organically (or at the very least as quickly) through Bella's POV. Comparing <i>Midnight Sun</i> to <i>Twilight</i>, my favorite additions are in regards to Edward's vampire life up until the events of the first book and moments where we read the Cullens' reactions to Bella as their relationship deepens. Literally every Cullen is so much more interesting through Edward's POV because we can actually spend time with them. Even Esme.<br/><br/>Where the book sours for me is the paranormal romance between Edward and Bella, which does save itself by the end but is severely harder to believe through Edward's POV compared to Bella's. I love the progression from vicious killer to vicious protector, but there's enough drawbacks to make me cover my mouth from a cringe rather than a sheepish smile. For one, Edward calls her ""the girl"" even after he learns about her name? What's that about? For two, Edward falling head over heels makes me start to hate Bella. This is because Meyers adds more dialogue details to their interactions that don't exist in the first book, and boy did she <i>not</i> need to because all of a sudden Bella becomes this agglomeration of the best female protagonists in classic literature. His view on Bella becomes disingenuous with these added details that aren't present in <i>Twilight</i>. We don't know Bella like that, which wouldn't be a problem if there weren't 4 books written for us to know Bella like that. Her concern for others, selflessness, and stubbornness are very clearly illustrated from her actions presented in the original saga. No need to tell us how she switched lockers with someone so two friends could have lockers side by side. It can be argued that Bella wouldn't share those details to the reader because she is someone who is so humble and reserved that she wouldn't flaunt how kind she is, but it happens too much for me to connect with her the way I did literally through her own book. Great and unexpected use of a <i>Somewhere in Time</i> reference though. You got me there.",,,1,0
36307674,"Rule of Wolves (King of Scars, #2)",Leigh Bardugo,"Bardugo, Leigh",,"=""1510109188""","=""9781510109186""",5,4.35,Orion Children's Books,Paperback,592,2021,2021,2024/08/16,2024/08/15,"books-that-made-me-cry, couldnot-put-down","books-that-made-me-cry (#8), couldnot-put-down (#36)",read,"I wish this book series had the same momentum given to franchises like <i>The Hunger Games</i> simply so I can delegate out ""Which country are you from in the Grishaverse?"" tests and talk extensively about each character and their best quotes, character developments, and pairings. I guess the closest we have to that right now is in the ACOTAR fandom, and I don't want to be involved there.<br/><br/>Simply put, I love the Grishaverse Bardugo has created. I love how this duology and this book especially dives into the dangers of war tech progression, religious corruption, and social change. I love how characters come together like it's a reunion party. When Kaz Brekker entered the scene, I was so excited! I love how these books can make me cry during burial services because I've grown so attached. And I love how no character is wasted. We find out those with smaller roles in both <i>King of Scars</i> and <i>Rule of Wolves</i> are mentioned in the threads of the other two series. I kept saying:<br/><br/><img src=""https://tenor.com/view/that-worked-out-perfectly-gif-25077660.gif"" width=""120"" height=""200""></img><br/><br/>not because things go well but how things connect from what we've established before.<br/><br/>Do I wish that Nina stayed tied to <spoiler>Matthias</spoiler>? Absolutely. Do I find what she's doing insane, fascinating, and believable? Also absolutely. Do I completely agree with the ending? Absolutely not. But is it insane, fascinating, and believable? Absolutely. DID I WANT A GENYA POV? ABSOLUTELY. But it wouldn't have added anything in the grand scheme of things. I just love Genya. Real Poppy vibes from the UN trilogy.",,,1,0
36307634,"King of Scars (King of Scars, #1)",Leigh Bardugo,"Bardugo, Leigh",,"=""125014227X""","=""9781250142276""",5,4.15,Imprint,Kindle Edition,511,2019,2019,2024/08/13,2024/08/06,"couldnot-put-down, books-that-made-me-cry","couldnot-put-down (#35), books-that-made-me-cry (#7)",read,"<i>""We have some bad news.<br/>There's more?<br/>It's Ravka. there's always more.""</i><br/><br/>This book goes HARD, expanding on the world as Ravka faces the consequences of civil war and the events brought about by our favorite thieves in Ketterdam. There are so many escalations happening in this story, but Bardugo manages to keep you interested, surprised, and above all else, hopeful.<br/><br/>Multi-POVs return, and it's just as brilliantly handled as it is in <i>Six of Crows</i>. Nikolai's pov is so natural alongside how we know him from the <i>Shadow and Bone</i> trilogy, and Zoya's pov is a great contrast, especially with how little we understand her from the original books. She quickly became one of my favorite characters. Her anger, sorrow, and resentment is understandable in its grief. The author even manages to introduce a completely new character in the second half of this story who you immediately want to protect at all costs. Isaak and Nina's storylines were my favorite only because their stakes were ever-present and one slip up meant immediate danger.<br/><br/>Had the second book READY after that jaw-dropping conclusion.",,,1,0
217366677,"Unity (UN, #3)",Kailey Bright,"Bright, Kailey",,"=""""","=""9798988230625""",0,5.00,Kailey Bright,Paperback,494,2024,,,2024/08/12,written-by-me,written-by-me (#3),read,,,,0,0
181350812,Bride,Ali Hazelwood,"Hazelwood, Ali",,"=""0593550404""","=""9780593550403""",5,4.00,Berkley,Paperback,396,2024,2024,2024/07/26,2024/02/08,couldnot-put-down,couldnot-put-down (#34),read,"This is a romance I can find myself returning to for cute moments, punchy dialogue, and steamy payoffs. I've never read an Ali Hazelwood romance, and if I'm being honest, I thought she would be terrible at it? But this (and I cannot stress enough) is a <i>great</i> love story with all the fun entanglements that come with an arranged marriage between a vampire and werewolf.<br/><br/>Misery and Lowe just play off each other to a surprisingly genuine degree; they feel like real people teasing, trying to understand one another, and dancing around when feelings are caught. If you love monster romance, omegaverse (yes, home girl goes all in), and marriage of convenience--I am begging you to pick this up and give it a chance.<br/><br/>Hazelwood also creates a strong conflict and history in this world that feels so seamless I worry people aren't going to give her flowers. It's just neat. The world is neat; the characters have different skill sets that I wasn't expecting (I would have dropped everything sooner if you told me Misery was a hacker!); and I love how bold the author is for essentially telling the reader a big secret that Misery has to figure out. The dramatic irony works when she's interacting with Lowe. I never feel frustrated; I feel like I'm picking up all the double meanings out the gate.<br/><br/>Truly my only critique is that secret's reveal. It could have had so much more punch for Misery to find out in the climax <spoiler>if it was like Meg confidently telling Hades that Hercules has no weaknesses and womp womp it's you girlie!!</spoiler> but it doesn't take away from the story for me. You might find more Hazelwood books on my tbr :)",,,1,0
199798179,The Ministry of Time,Kaliane Bradley,"Bradley, Kaliane",,"=""1668045141""","=""9781668045145""",4,3.59,Avid Reader Press / Simon & Schuster,Hardcover,339,2024,2024,2024/07/20,2024/07/18,couldnot-put-down,couldnot-put-down (#33),read,"I absolutely love how our entire perception of Commander Graham Gore is now shaped by Bradley's novel--does she understand how powerful that is? For me to fall in love with a characterized version of a real man who died 200+ years ago and we only have one photo of? I hope she knows.<br/><br/>This is definitely one of those books you just have to read--which might sound unhelpful but <i>trust</i> me, the more blind you go into this, the more you'll be pulled in. But for a little more specific information: The prose is so personal; I love how the nameless protagonist is essentially documenting her year as a housemate to a naval officer from 1845 to the reader similarly to how she's documenting everything to the Ministry. The romance is a charming and realistic friends-to-lovers. And there is great build-up to something going terribly terribly wrong as time travel often encourages.<br/><br/>I feel like I need to reread to fully understand some plot points, and the time traveling logic is very much a 'just go with it' vibe with little explanation on the <i>how</i> of things which is never my favorite way of going about any sci-fi technology. Bradley put so much effort into giving me information about the past; I wish she put a little more effort into the futuristic time door.",,,1,0
50659467,"A Court of Thorns and Roses (A Court of Thorns and Roses, #1)",Sarah J. Maas,"Maas, Sarah J.",,"=""1635575567""","=""9781635575569""",3.5,4.17,Bloomsbury Publishing,Paperback,419,2020,2015,2024/07/18,2024/07/14,,,read,"3.5 ⭐<br/><br/><i>Mom, I want to reread The Cruel Prince!<br/>We have The Cruel Prince at home.<br/>The Cruel Prince at home:</i><br/><br/>That might not be an entirely fair assessment, but it was certainly my persistent thought up until the midpoint of <i>A Court of Thorns and Roses</i>. This introduction into Maas's fae series is quite the slowburn, not just in its romance but also in its story. Up until the midpoint where we reach our Fire Night scene, Feyre's journey is relatively stagnant for someone who was kidnapped by a dangerous creature and forced to live with him away from everything she's ever known. As readers, we don't worry for her family's potential starvation the way she does. It's just not something we care about considering their negative/harmful relationship to her and how Tamlin (the fae who kidnaps her) seemingly takes care of them in her absence. As much as I hate how a lot of faerie lore is tossed out the window, I was really hoping they would use the sudden ability to lie in a meaningful way. What if Tamlin isn't actually taking care of them the way he says he is? That would have made Feyre's insistence to find a loophole and escape something we can actually grab onto and want to follow her through that thought-process. But no; it's just faerie lore tossed out the window.<br/><br/>What does grab my attention is the introduction of Rhysand, a potentially even more dangerous High Lord of the Night Court. He's the wrench that actually gets the plot-ball rolling because he adds conflict, fear, stakes, momentum--you get the idea. Up until he walks into Tamlin's dining room, all of the relationships between characters feels muddled (outside of the three sisters; that's clear and great). It's only when Rhysand enters the chat that I actually feel any real connection between Feyre, Tamlin, and Lucien. They're finally being confronted with something and have to do so together and in their own way. I wish there was more brewing tension before Rhysand's arrival; it's like the characters are all waiting for the next big thing to happen the same way you wait for the train to arrive for your morning commute--not when you're tied to the tracks, clawing at your restraints, counting down the seconds until the train strikes you.<br/><br/>The trials are great. I love how everything has weight, how everyone uses Feyre for their own gain, and ultimately, how love triumphs all. There's plenty of foreshadowing of what is to come next, and the book ends on a comforting note that leaves you itchy for the next installment. I gotta wait 20 weeks though for my copy from the library so don't wait up.",,,1,0
50531218,"The Hawthorne Legacy (The Inheritance Games, #2)",Jennifer Lynn Barnes,"Barnes, Jennifer Lynn",,"=""0241480744""","=""9780241480748""",3,4.19,Penguin,Hardcover,380,2021,2021,2024/07/10,2024/07/02,,,read,"I need a whiteboard to properly draw out this messy, messy family. I'm assuming/hoping Barnes has one stashed away somewhere to make sure she kept track of everything. The beginning of this book honestly dragged for me and caught my attention as plot threads became more and more complicated. But with that complication came convolution, and Barnes struggles to hold <i>The Hawthorne Legacy</i> on that tightrope. Compels me though. The love triangle is still vague; it's pretty clear who she'll choose considering how much time and energy she spends with one over the other. There's moments where Avery isn't sure, but I love how it's more about her feeling like there's no one for her rather than both. The seaside romance Max brings up is honestly the best recurring motif, and I wasn't expecting to enjoy that question haunting Avery as she continues trekking through the nightmare that is her new life: <i>Close your eyes. Picture yourself standing on a cliff overlooking the ocean. The wind is whipping in your hair. The sun is setting. You long, body and soul, for one thing. One person. You hear footsteps behind you. You turn. Who's there?</i>",,,1,0
14061957,"Ruin and Rising (The Shadow and Bone Trilogy, #3)",Leigh Bardugo,"Bardugo, Leigh",,"=""""","=""""",5,3.98,Henry Holt and Company,Hardcover,350,2014,2014,2024/07/07,2024/07/03,,,read,"Edit: Okay I think I'm distanced enough now to give a proper written review<br/><br/>I'm so satisfied with the conclusion of this trilogy and the third book as a whole. Bardugo wraps this trilogy with intentional hands, offering us final darklina moments, a plot twist that I did not see coming but is a jaw-dropping-oh-my-gosh-this-changes-everything-that's-so-good twist that's been coming since book 1, and some cool expansions to both Alina's power and the world at large. With such a large death count too, I was really worried for all my favorite characters. The tension and stakes are ever-present, and if you forget for one second, Bardugo choses the right moment to make sure you don't.<br/><br/><spoiler>I know a lot of people don't like it when the female lead loses/sacrifices her powers at the end, but I think this is a rare instance where this works on every level. Welcome to my brief video essay. Firstly, she thought she would be ascending to the highest form of power and claimed the exact opposite. She didn't willingly sacrifice her powers because she didn't know that would be the consequence. Secondly, her connection to the Darkling is severed forever because now ""she is nothing"". When he realizes that he is now forever alone in the world--heartbreaking--her realizing that he can never haunt her in the same way again--amazing. Thirdly, her and Mal finally get to live their ordinary life! The one they tried to escape to and the one that they thought they could never have is now here. I'm crying. It's brilliant. She won't outlive him; they can run into the meadow whenever they want; they are free to choose each other without the obligations of sainthood or queenhood or anything else Alina didn't want to be since the beginning. You are welcome to disagree, go write fanfic.</spoiler><br/><br/>I have to add some of my favorite quotes because they will live rent free in my head forever:<br/><i>""You could have made me a better man.""/""You could have made me a monster.""</i><br/><i>""I am not ruined. I am ruination.""</i><br/><i>""Beauty was your armor. Fragile stuff, all show. But what's inside you? That's steel. It's brave and unbreakable. And it doesn't need fixing.""</i><br/><i>""He watches her the way Harshaw watches fire. Like he’ll never have enough of her. Like he’s trying to capture what he can before she’s gone.""</i><br/><i>""I’ve never understood this taste for otkazat’sya. Is it because you thought you were one of them for so long?”/“I had a taste for you, once.""</i><br/><i>""They had an ordinary life, full of ordinary things—if love can ever be called that.""</i>",,,1,0
22918050,"The Heir (The Selection, #4)",Kiera Cass,"Cass, Kiera",,"=""""","=""""",2.5,3.63,HarperTeen,Kindle Edition,342,2015,2015,2024/06/15,2024/06/13,,,read,"2.5 ⭐<br/><br/>It's hard to review a book that shouldn't exist...or at the very least a book that should not be a direct sequel to <i>The One</i>.<br/><br/>We don't have any opportunity to sit in the weight of Book 3's ending. It was the first time we see death on a personal level in this series, and it's a complete waste not to mourn for people you've made us care about. We're supposed to believe that America's journey is over when that cannot be further from the truth. Wrapping up the revolution loose ends in their first year of marriage should have been the 4th and final book and this subsequence Heir/Crown duology should have come later.<br/><br/>That being said, I've tried to give this book a fair shake. After all, it does exist despite my protest. I like that Eadlyn is a dislikable character; her unique position as the first female heir mixed with her privileged position means she's distant, unsympathetic, and shallow. Which makes for great conflict with the relationship she has with herself, the Selected, and the country at large.<br/><br/>However, Eadlyn doesn't become someone we can root for or root against. There's sparse moments where we as the reader want her to disrupt the Selection or embrace it. I simply don't care nearly as much because the stakes aren't worrisome. With America, she could be eliminated at any moment, and there's real fear in Maxon's decision to keep or boot her. With Eadlyn, she is the one eliminating. I like how the author makes us root for a lot more of the Selected instead of the original trilogy's love triangle, but unfortunately that means that all of them would make a great choice and I'm not as worried about who she chooses. (Team Erik though if I get any say).<br/><br/>I also would be amiss if I didn't mention the pacing. What has worked for Kiera Cass in the past is not working here. There was nothing satisfying about Eadlyn finally taking the Selection seriously the same way it's satisfying for America to take her role as the Selected seriously. And I think it has to do with everything I've already mentioned. I imagine this book would have been more successful if we ended part 1 with her flip in priorities/motivations and continued forward without a cliffhanger. I'm determined to finish out this series, but unfortunately, I don't have the same excitement.",,,1,0
