Book Id,Title,Author,Author l-f,Additional Authors,ISBN,ISBN13,My Rating,Average Rating,Publisher,Binding,Number of Pages,Year Published,Original Publication Year,Date Read,Date Added,Bookshelves,Bookshelves with positions,Exclusive Shelf,My Review,Spoiler,Private Notes,Read Count,Owned Copies
56279770,"Take Your Turn, Teddy",Haley Newlin,"Newlin, Haley",,"=""1636765556""","=""9781636765556""",0,3.78,New Degree Press ,Paperback,382,2020,,,2025/05/01,"currently-reading, indie-darlings","currently-reading (#1), indie-darlings (#11)",currently-reading,,,,1,0
2767052,"The Hunger Games (The Hunger Games, #1)",Suzanne Collins,"Collins, Suzanne",,"=""""","=""""",5,4.34,Scholastic Press,Hardcover,374,2008,2008,2025/05/01,2025/05/01,classics,classics (#6),read,The blueprint. ,,,1,0
160047094,"Dungeons and Drama (Dungeons and Drama, #1)",Kristy Boyce,"Boyce, Kristy",,"=""0593647017""","=""9780593647011""",4,4.13,Delacorte Press,Paperback,304,2024,2024,2025/04/29,2025/04/27,"couldnot-put-down, reader-suggested","couldnot-put-down (#47), reader-suggested (#13)",read,"I needed this cute easy read after the week I had. I'm a little too old for high school romances, but this one won me over easily. There's just a few moments of contemporary comments in the beginning that made me cringe.",,,1,0
221608550,Thorns of Winter,Moriah Chavis,"Chavis, Moriah",,"=""""","=""9798330574872""",0,4.24,Twenty Hills Publishing,Kindle Edition,38,2025,,,2025/04/25,indie-darlings,indie-darlings (#10),read,,,,1,0
216912389,The Button Collector,M.M. Cochran,"Cochran, M.M.",,"=""1952961254""","=""9781952961250""",3.5,4.06,IngramElliott,Kindle Edition,314,2024,,2025/04/22,2025/04/18,indie-darlings,indie-darlings (#9),read,"3.5 ⭐<br/><br/>I don't get to read a lot of main characters who are terrible and I still find myself wanting to read about them. With the mystery, light romance, and bittersweet ending, this would make a great early 2000's movie",,,1,0
214331246,"Sunrise on the Reaping (The Hunger Games, #0.5)",Suzanne Collins,"Collins, Suzanne",,"=""1546171460""","=""9781546171461""",5,4.62,Scholastic Press,Hardcover,387,2025,2025,2025/04/15,2025/04/11,couldnot-put-down,couldnot-put-down (#46),read,"It's Suzanne Collins, are you really that surprised?<br/><br/>I thoroughly enjoyed the conflict here. It's explicit, but the way Haymitch must constantly confront complicit compliance always left me with goosebumps. He's damned if he does and he's damned if he doesn't, and that adds to the overall hopelessness and tension threaded throughout this story. I won't say anymore because I want you to read it!",,,1,0
127306192,Anita de Monte Laughs Last,Xóchitl González,"González, Xóchitl",,"=""1250786215""","=""9781250786210""",3,3.80,Flatiron Books,Hardcover,342,2024,2024,2025/04/04,2025/03/31,,,read,I had to drop a star after finding out that this was a robbed historical fiction ,,,1,0
176822897,The Hedgewitch of Foxhall,Anna  Bright,"Bright, Anna",,"=""0063083574""","=""9780063083578""",5,3.74,HarperCollins,Hardcover,392,2024,2024,2025/03/29,2025/02/05,couldnot-put-down,couldnot-put-down (#45),read,"Obsessed. Enthralled. I want to stare at this cover for the rest of my life.<br/><br/><i>The Hedgewitch of Foxhall</i> was full of Welsh magic; I think I was teleported into a Cartoon Saloon movie (yes I know they do Irish folklore but it has the VIBES). Ffion has my whole heart; she is a wild, fiery redhead who does not stop once she's started. The romance is swoony (and not spicy for those who are worried); I usually don't like love triangles but I was sat for this one. And the way the author reveals small facets of this world and its characters is masterful. <spoiler>The way I gasped over who the court magician was;</spoiler> something almost irrelevant in the beginning becomes drastically important later. I want to learn how to write like this, truly.",,,1,0
73071451,"Throne of the Fallen (Prince of Sin, #1)",Kerri Maniscalco,"Maniscalco, Kerri",,"=""031655751X""","=""9780316557511""",3,4.00,"Little, Brown and Company",Kindle Edition,612,2023,2023,2025/03/25,2025/03/12,,,read,"Returning to the <i>Kingdom of the Wicked</i> world was a fun time! I didn't realize how adult these books already were until I started reading other, more explicitly adult works, so I wouldn't say this is her first adult novel but you do you Little, Brown and Company.<br/><br/>The Prince of Envy was my favorite character in her original series, so he's just even more enjoyable here. I love the game at play and the conflict between characters here--seriously, the opposing forces at work are excellent. And I loved reading the princes interact. We didn't get so much of that in the original trilogy. However, I still found myself force reading this book here and there despite enjoying the story. Hopefully that's not everyone's experience; I found this book to be really long and the stakes suffering because of it.",,,1,0
42771754,"Supernova (Renegades, #3)",Marissa Meyer,"Meyer, Marissa",,"=""1250078385""","=""9781250078384""",2.5,4.38,Feiwel & Friends,Hardcover,549,2019,2019,2025/03/21,2025/03/11,,,read,"2.5 ⭐<br/><br/>I might be being a little harsh with this one; this is my first Marissa Meyer disappointment! An excellent start--honestly had me at the edge of my seat as Nova's secret identity begins crumbling--and then...well the second half happened. At first, I was excited that the Mirror Walker was returning from her disappearance in the first novel, but the execution was incredibly sloppy, difficult to believe, and difficult to finish. And the epilogue?? Did I not understand the themes of this story or did the ending just throw those themes out the window?",,,1,0
117562172,"The Sea Witch: A Little Mermaid Retelling (Beloved Villains, #1)",Rebecca F. Kenney,"Kenney, Rebecca F.",,"=""""","=""""",3.5,4.09,,Kindle Edition,431,2023,2022,2025/03/10,2025/03/10,"couldnot-put-down, indie-darlings","couldnot-put-down (#44), indie-darlings (#8)",read,3.5 ⭐<br/><br/>Don't judge me too harshly; I will be reading another.,,,1,0
35425827,"Archenemies (Renegades, #2)",Marissa Meyer,"Meyer, Marissa",,"=""1250311446""","=""9781250311443""",4,4.24,Feiwel & Friends,ebook,560,2018,2018,2025/03/10,2025/03/02,,,read,"An absolute nail-biter. Marissa Meyer puts in the work to make me believe Nova and Aiden are falling in love with each other while simultaneously tearing me up at the seams as they try to outmaneuver each other. The dread, action, and conflict are all here making a terribly delicious concoction; the ending really pulls everything together with a menace. A part of me laughed out loud that home girl added a gala scene (the contemporary version of a ballroom scene and also the finale of her <i>Instant Karma</i> book), but I get it--they're hard to resist. And there are a couple of slow moments that could have prolonged my reading if I wasn't listening to the audiobook. Nevertheless, this is a superhero/villain story still worth your time, and my jaw is already dropped going into <i>Supernova</i>.",,,1,0
53138095,"A ​Court of Silver Flames (A Court of Thorns and Roses, #4)",Sarah J. Maas,"Maas, Sarah J.",,"=""168119628X""","=""9781681196282""",5,4.46,Bloomsbury Publishing,Hardcover,757,2021,2021,2025/03/06,2025/01/06,books-that-made-me-cry,books-that-made-me-cry (#11),read,"It's difficult to talk about this book without being extremely personal, which tells you already how SJM pours her heart into this story. So many home-hitting lines about mental illness, self-worth, and relationships. Nesta's journey is palpable and resonated with me in ways I didn't expect; I became encouraged to keep my fitness goals and forgave a friend who I didn't realize still hurt my feelings. That's crazy. Very few books alter my chemistry like this. I can't believe I got sucked into acotar and am happy for it.",,,1,0
28421168,"Renegades (Renegades, #1)",Marissa Meyer,"Meyer, Marissa",,"=""1250044669""","=""9781250044662""",3.5,4.12,Feiwel & Friends,Hardcover,552,2017,2017,2025/02/27,2025/02/19,,,read,"3.5 ⭐<br/><br/>This book taught me that sometimes Prologues should be left on the cutting room floor. The slow exposition dump at the beginning really dragged out the excitement the rest of <i>Renegades</i> carries, and I laughed out loud at the naming convention of Ace Anarchy. Obviously I got used to it, but I imagine most people don't want their reader to immediately not take the central villain seriously.<br/><br/>Meyer draws from superhero comics in a fun and engaging way after the fact: everyone has unique abilities, backstories, and their relationships to each other directly relate to a world built organically. I love the subtle use of powers--I'm still thinking about the lady who can touch objects and see their history--and the in/out of characters never made me feel like anyone was forgotten within such a huge ensemble cast. Honey Harper has a special place in my heart; she ate up every scene and I hope we see more of her in the coming books.<br/><br/>Now Meyer is known for her romance, and she does disappoint to some extent here. I enjoyed the POV shifts in this book, which is unique from what I've read of hers before. Both Aiden and Nova have secrets they're trying to keep from each other, and I like how we as the reader are privy to both so we can watch how they try to circumnavigate each other while also in forced proximity. There are cute moments and returning banter, but it was never truly enough to make me see them as potential romantic partners right up until the end of an amusement park scene. I think I just need mcs to stop saying how attractive a person is right out the gate; it's becoming a lazy subtle nod that these two will be romantically interested in each other before they ever have any real chemistry. Nevertheless, I'm excited to see how their relationship pans out in <i>Archenemies</i> because THAT ENDING--",,,1,0
201126787,"The Darkness Within Us (The Shadows Between Us, #2)",Tricia Levenseller,"Levenseller, Tricia",,"=""1250840775""","=""9781250840776""",2,3.91,Feiwel & Friends,Hardcover,336,2024,2024,2025/02/22,2024/09/17,,,read,"I'm so disappointed. The premise starts strong but is executed with little confidence. The writing lacks subtlety as the story progresses, and there are several unnecessary scenes and locational decisions that could be either cut or refined. There is absolutely no reason why an author should feel the need to explain the enemies-to-lovers trope for the characters to tease each other with; it's not cheeky, it's incredibly meta in a world already difficult to immerse yourself in. I thoroughly enjoyed the blooming romantic beats between Chrysantha and Eryx--I really wish the couch/chair scene was in a much better book so I could recommend it to other people.",,,1,0
58874675,The Honeys,Ryan La Sala,"Sala, Ryan La",,"=""133874531X""","=""9781338745313""",4.5,3.80,PUSH,Hardcover,344,2022,2022,2025/02/17,2025/02/17,couldnot-put-down,couldnot-put-down (#43),read,"4.5 ⭐<br/><br/>This book creeped me out so bad! I love the imposing atmosphere, suspicious characters/activity, and pacing. Usually the driving force loses its importance for me, but every time Caroline's name is brought up, I could feel the sting of her death all over again. The grief is palpable, and it made all the more sense once I reached the Acknowledgements page. <i>The Honeys</i> would honestly make a great season of television. I just wish the twist and honey community had a fuller explanation; it doesn't hinder the story but it's too fascinating and permanent to keep us in the dark.",,,1,0
134912704,Heart of the Sea,Moriah Chavis,"Chavis, Moriah",,"=""1957899425""","=""9781957899428""",0,4.03,Quill & Flame Publishing House,Paperback,314,2023,2023,2025/02/13,2025/01/20,indie-darlings,indie-darlings (#7),read,,,,1,0
53174679,"Instant Karma (Instant Karma, #1)",Marissa Meyer,"Meyer, Marissa",,"=""1250618819""","=""9781250618818""",4,3.75,Feiwel & Friends,Hardcover,400,2020,2020,2025/02/07,2025/01/31,,,read,"Contemporary romance is <i>not</i> my go-to genre, but I'm on a mission to read all of Marissa Meyer's works this year and <i>Instant Karma</i> caught my attention more than her others in the same section.<br/><br/>I really enjoyed this book, and it probably has a lot to do about how Prue reflects myself in high school. She's a straight-A student who can't handle anything less, doesn't trust other people to do work she could do herself, and judges others very easily if they don't align with her viewpoint around academia/financial success. And it doesn't hurt that I'm from a tourist town with a low middle-class family background. Seriously, did Marissa Meyer go back in time and observe me at 16?? Prue sings to my heart in a way that can make me laugh while she's clearly in the wrong but just doesn't know it yet. I know; I lived it.<br/><br/>And Meyer either seemed to have lived it too or really understands how teenagers are because the other characters do not miss. Everyone starts out one dimensional: the overachiever, the slacker, the brother, the best friend, the activist, the mean girl crush, etc. But as the story goes on and wacky Karma powers kick in, Prue begins to see the people she grew up with as more than what she labeled them (and vice versa). I absolutely love how subtle and organic the growth is in this regard. The author packs a lot of setup, and for the most part, they pay off.<br/><br/>I only wish that the Karma plotline somehow ended up helping Prue's family and their business, or Prue's growth into an event coordinator would have helped them at the end. That was the last string I was left feeling untucked. I liked the scene where Prue's mother explains that these things they're giving away are just stuff, and I like the sentiment that the exploration of their lives are more important than the items left behind by people long gone, but they're still struggling. They're still having to do Band-Aid solutions, and I don't think I have to read the second book in order for that to at least be hinted at or starting to resolve by the end of this one.",,,1,0
61250159,"The Prisoner’s Throne (The Stolen Heir Duology, #2)",Holly Black,"Black, Holly",,"=""0316592730""","=""9780316592734""",3.5,3.89,"Little, Brown",Kindle Edition,359,2024,2024,2025/02/05,2025/02/06,couldnot-put-down,couldnot-put-down (#42),read,"3.5 ⭐<br/><br/>Noooo my Wren POV (╯︵╰,)  vs Yaaay Jurdan is BACK ✧♡(◕‿◕✿) And treating me with more Jack of the Lakes? Holly, you shouldn't have (◌˘◡˘◌)<br/><br/>But in all seriousness, this was a fun ride with a fun mystery to unravel. I enjoyed being afraid <i>of</i> Jude rather than afraid <i>for</i> her, and I loved Oak's character development as he grappled with his role, his family's expectations, and his love for an impossible girl. As much as I understand why Wren can't have a POV for the mystery to work, I can't help but note that the writing style related to her perspective is what enchanted me in this duology, which is not present here.",,,1,0
61198133,"The Stolen Heir (The Stolen Heir Duology, #1)",Holly Black,"Black, Holly",,"=""0316592706""","=""9780316592703""",4,3.94,"Little, Brown Books for Young Readers",Hardcover,356,2023,2023,2024/10/30,2024/11/15,,,read,"Bumping this up to 4 ⭐ after reading <i>The Prisoner's Throne</i>.<br/><br/>Holly Black is back and she's returning me to Elfhame. I love Wren as the trash goblin she is and a unique inverse to Jude, to be a Fae who wants to belong in the human world. The prose is gorgeous; I was always left feeling more adrift and introspective after reading through Wren's POV.<br/><br/>Unfortunately, I became quite detached from the plot as a whole. Their journey, interesting in itself, had a destination I couldn't find myself invested in. Lady Nore and the threat she poses is distant and never feels out of control, and her relationship to Wren is way more intriguing in the backstory we receive rather than in the current moment. Even the ending, albeit engaging, also confused me. Oak and Wren's relationship and interactions are great, but I didn't see any foreshadowing that would suggest the decisions made that make this book a duology.",,,1,0
40381392,"Finale (Caraval, #3)",Stephanie Garber,"Garber, Stephanie",,"=""1250157668""","=""9781250157669""",5,4.14,Flatiron Books,Hardcover,478,2019,2019,2025/01/28,2025/01/20,,,read,"I would be in denial if I didn't give the last book in the Caraval series a 5 stars. Finally, Stephanie Garber adds trial and error in her work (maybe a little too much in this one but c'est la vie). It might be odd to cheer for so many things going wrong and for plans to constantly be changing, but my usual critique of her storylines are how convenient they feel. Maybe the cause and effect is so natural, but I often find these high-stake situations pointedly linear. That is not the case for <i>Finale</i>. I was worried at first that Donatella would overtake her sister for best pov, but their storylines end up being just as interesting as the book progresses. Well done. The Evangeline cameo was something I was not expecting either but fully adored.",,,1,0
36329818,"Legendary (Caraval, #2)",Stephanie Garber,"Garber, Stephanie",,"=""125009531X""","=""9781250095312""",4,4.12,Flatiron Books,Hardcover,451,2018,2018,2025/01/15,2025/01/10,,,read,"The introduction of Jacks was everything I could ever ask for from this universe. I was genuinely surprised to find myself liking Tella a lot more in this novel than I did her character in the first book. Though <i>Legendary</i> is in her pov and that'll help me understand her better, it's the way Garber challenges her in the second installment that makes me respect and enjoy her story more. I also like that there's a clear difference in how each sister plays the game of Caraval based off their personalities and past experience with where they were in the first game. Unfortunately, the ending didn't grab me the way the first book's ending did; I'm going to complete the trilogy only to say I did rather than any gripping need to know what happens next.",,,1,0
205181098,The Thirteenth Child,Erin A. Craig,"Craig, Erin A.",,"=""0593482581""","=""9780593482582""",5,4.08,Delacorte Press,Hardcover,512,2024,2024,2025/01/16,2024/08/29,"books-that-made-me-cry, couldnot-put-down","books-that-made-me-cry (#10), couldnot-put-down (#41)",read,"This is my favorite Erin Craig book so far. She combines everything that she excels at in her other works: complex and realistic sibling relationships, a swoony romance, and horrific twists and turns. I cried terribly at the ending, and I'd recommend this to everyone, even if horror and fantasy is not your usual cup of tea.",,,1,0
217953353,Voice of the Ocean,Kelsey Impicciche,"Impicciche, Kelsey",,"=""""","=""9798212980906""",0,4.01,"Blackstone Publishing, Inc.",Hardcover,400,2025,2025,,2025/01/12,to-read,to-read (#24),to-read,,,,0,0
27883214,"Caraval (Caraval, #1)",Stephanie Garber,"Garber, Stephanie",,"=""1250095255""","=""9781250095251""",4,3.97,Flatiron Books,Hardcover,407,2017,2016,2025/01/08,2025/01/06,,,read,"Stephanie Garber always conflicts me. She's fantastic at romantic tension, uncertain heroines, and keeping me caught on her every word. And those words are full of color, hype specific descriptions, and intrigue. It's the sisterly devotion that I couldn't quite connect with; the drive that keeps Scarlet going. The plot always somehow feels both convenient and the most out of pocket, too. I don't think I'd read so much of her work if it wasn't for Rebecca Soler reading the audiobooks. And yet I am reading with abandon every second I can.",,,1,0
164444179,First Lie Wins,Ashley Elston,"Elston, Ashley",,"=""""","=""""",5,4.01,Pamela Dorman Books,Hardcover,340,2024,2024,2025/01/02,2025/01/06,reader-suggested,reader-suggested (#12),read,"1st read for my Book Club complete!<br/><br/>This story had me captivated from beginning to end, the flow of events giving me just enough information and holding just enough of the same to keep me enthralled. I love how we're trying to figure out our main character while also in her point of view. As though we are somehow both Evie's most trusted confidant and the ladies at the luncheon, prodding but unsuccessful. And the cat and mouse game with Mr. Smith--is it wrong for me to say he's a hear-me-out??",,,1,0
50659471,"A Court of Frost and Starlight (A Court of Thorns and Roses, #3.5)",Sarah J. Maas,"Maas, Sarah J.",,"=""1635575621""","=""9781635575620""",5,3.73,Bloomsbury Publishing,Paperback,272,2020,2019,2025/01/02,2025/01/06,,,read,This was the slice of life episode of ACOTAR that nobody asked for but was pleasantly nice. Very cozy like it's entire Christmas atmosphere. Would most likely read again out of all the books (and I'm not just saying that because it's the shortest!),,,1,0
199407665,"Beautiful Villain (Gilded Monsters, #1)",Rebecca F. Kenney,"Kenney, Rebecca F.",,"=""""","=""""",3,3.22,Sourcebooks Casablanca,ebook,394,2024,2024,2024/12/15,2024/12/26,indie-darlings,indie-darlings (#6),read,"Take a shot every time you recognize something contemporary and you will die (especially if you live in upstate SC/western NC)<br/><br/>This was a fun, easy read with a soft second-chance romance, vampires, and a thread of mythology. The effort to keep it a standalone didn't ring as effortless since there were so many liabilities surrounding this version of Gatsby's rise to power and how vampires exist through science.",,,1,0
50659472,"A Court of Wings and Ruin (A Court of Thorns and Roses, #3)",Sarah J. Maas,"Maas, Sarah J.",,"=""1635575605""","=""9781635575606""",4,4.47,Bloomsbury Publishing,Paperback,699,2020,2017,2024/11/25,2024/10/08,,,read,"I thought this would be a slam dunk 5 until the final battle occurred. I loved the first 3/4ths of this book! Coming in from Book 2, Feyre <i>is</i> the High Lady of the Night Court and takes a lot more strides moving the plot along with her newfound confidence and role. All of the characters are given unique conflicts with themselves and each other that kept me on my toes even in the most neutral of dialogue scenes. Hybern is terrifying as a central villain, and his newfound threat to the world left me genuinely wondering how they were going to prevail. Tamlin's ever dual and uncertain nature was honestly peak; I don't understand how y'all can hate him so much.<br/><br/>The ending is just unnecessarily funny. It cycles hollow goodbyes and ex machinas in such a loop that I can't take it seriously anymore (the exception being Nesta and Cassian because they were in the most genuine danger). Earlier confrontations with the main antagonist held more weight and more of my breath in equal measure. The final battle is fun, but it seriously drags down the narrative with poor writing, lowered stakes, and a wave of new characters that should have either had their own book or pov chapters alongside the main story. Give me the Lucien POV you coward!",,,1,0
7842288,"Beautiful Darkness (Caster Chronicles, #2)",Kami Garcia,"Garcia, Kami",Margaret Stohl,"=""0316077054""","=""9780316077057""",2,3.83,"Little, Brown and Company",Hardcover,503,2010,2010,2024/10/30,2024/11/15,,,read,"I'll only be padding my 2024 Reading Challenge if I continue with this book series. I don't know how there are 4 books in this series, and I don't want to know.",,,1,0
6304335,"Beautiful Creatures (Caster Chronicles, #1)",Kami Garcia,"Garcia, Kami",Margaret Stohl,"=""0316042676""","=""9780316042673""",3,3.77,"Little, Brown and Company",Hardcover,563,2009,2009,2024/10/30,2024/11/15,,,read,Finally read this 2010's YA after loving the movie for years and I can safely say that the movie is better. Incredibly so.,,,1,0
209606149,First Word: A Novel of the Dying Light Archive,C.M. Brown,"Brown, C.M.",Lily Ingersoll,"=""1963266129""","=""9781963266122""",5,5.00,Runespring Publishing,Kindle Edition,382,2024,,2024/04/16,2024/04/10,"indie-darlings, couldnot-put-down","indie-darlings (#2), couldnot-put-down (#21)",read,"Amazing read! I'm so thankful that this book entered my radar. Every chapter hits; the pacing and action sequences are inventive and tailored to its worldbuilding. All of the characters, their skillset, and their relationships are well thought-out. The ending shocked me; I was devastated to flip to the next page only to find that the book was finished. Without giving spoilers, there's a clear momentum forward while also maintaining its uncertainty. Will be one of the first to purchase the second! If you love anthropomorphic storytelling, magic systems, adventure, and mystery--give this indie darling your time.",,,1,0
52516231,Stars Above: A Lunar Chronicles Collection (The Lunar Chronicles),Marissa Meyer,"Meyer, Marissa",,"=""1250774063""","=""9781250774064""",4,4.15,Square Fish,Paperback,369,2020,2016,2024/10/10,2024/10/08,couldnot-put-down,couldnot-put-down (#40),read,"My thoughts on each story:<br/><br/>The Keeper - Grandmere's POV was so good; we love a self-aware mom<br/>Glitches - Not the first time Cinder's liar detector goes off; you're tearing me apart<br/>The Queen's Army - I love what was chosen for Ze'ev; I would love for more of his POV in regards to Scarlet in the second book ngl<br/>Carswell's Guide to being Lucky - They still have a no tolerance policy in the third era??<br/>After Sunshine Passes By - Rebecca Soler singing as Cress is HEARTBREAKING<br/>The Princess and the Guard - Jacin x Winter content is everything to me<br/>The Little Android - There was no reason for Marissa Meyer to hurt me like this<br/>The Mechanic - I wanted more of this!! More mmc POVs please.<br/>Something Old, Something New - I'm in love, absolutely in love",,,1,0
